### ISSUE TITLE
Swap continues despite LND <-> peerswapd disconnect

### ISSUE THREAD

**Issue by grubles** [ElementsProject/peerswap#125]
When attempting to disrupt the connection between `peerswapd` and LND with `tcpkill`, a swap is still able to complete somehow. 

`tcpkill` seems to be repeatedly killing reconnection attempts. This occurs continuously and is pretty CPU intensive:

When running `$ sudo tcpkill -i any -9 port 10009`:
```
<snippet>
127.0.0.1:10009 > 127.0.0.1:60948: R 4092094968:4092094968(0) win 0
127.0.0.1:60948 > 127.0.0.1:10009: R 585885286:585885286(0) win 0
127.0.0.1:60948 > 127.0.0.1:10009: R 585885791:585885791(0) win 0
127.0.0.1:60948 > 127.0.0.1:10009: R 585886801:585886801(0) win 0
127.0.0.1:60948 > 127.0.0.1:10009: R 585888316:585888316(0) win 0
</snippet>
```

~/.peerswap/log

```
2022/08/31 19:25:13 [DEBUG] [grpc_conn]: grpc_retry attempt: 122, backoff for 30s                                                           
2022/08/31 19:25:13 [DEBUG] [grpc_conn]: grpc_retry attempt: 74, backoff for 30s 
2022/08/31 19:25:13 [DEBUG] [grpc_conn]: grpc_retry attempt: 1, backoff for 30s  
2022/08/31 19:25:13 [DEBUG] [grpc_conn]: grpc_retry attempt: 74, backoff for 30s 
2022/08/31 19:25:13 [DEBUG] [grpc_conn]: grpc_retry attempt: 74, backoff for 30s 
2022/08/31 19:25:30 [DEBUG] [grpc_conn]: grpc_retry attempt: 0, got err: rpc error: code = Unavailable desc = error reading from server: read tcp 127
.0.0.1:55296->127.0.0.1:10009: read: connection reset by peer                                                                                        
2022/08/31 19:25:30 [DEBUG] [grpc_conn]: grpc_retry attempt: 1, backoff for 30s  
2022/08/31 19:25:43 [DEBUG] [PaymentWatcher] Swap: f4e37b4d1fb0cbb62b4b40212639001860e446e4b0fce17ada0acdb4434c7d58: Calling paymentCallback
2022/08/31 19:25:43 [DEBUG] [FSM] event:id: f4e37b4d1fb0cbb62b4b40212639001860e446e4b0fce17ada0acdb4434c7d58, Event_OnClaimInvoicePaid on State_SwapI
nSender_AwaitClaimPayment                                                                                                                            
2022/08/31 19:25:43 [INFO] [Swap:f4e37b4d1fb0cbb62b4b40212639001860e446e4b0fce17ada0acdb4434c7d58] Swap claimed with preimage 814fca92f7a86a52859495e
e9d8af6d8cc356f5e99f6e00a164b1dd25ccb4351                                                                                                            
2022/08/31 19:25:43 [DEBUG] [grpc_conn]: grpc_retry attempt: 123, backoff for 30s
2022/08/31 19:25:43 [DEBUG] [grpc_conn]: grpc_retry attempt: 75, backoff for 30s 
2022/08/31 19:25:43 [DEBUG] [grpc_conn]: grpc_retry attempt: 75, backoff for 30s 
2022/08/31 19:25:43 [DEBUG] [grpc_conn]: grpc_retry attempt: 75, backoff for 30s 
2022/08/31 19:26:00 [DEBUG] [RedundantSender]   stop sending messages of type 42077 to 0363b14124d0cd630087cba0cac7145d17ccef4a6de2770dff7a8b1cbaffd4
ed30                                                                                                                                                 
2022/08/31 19:26:13 [DEBUG] [grpc_conn]: grpc_retry attempt: 76, backoff for 30s 
2022/08/31 19:26:13 [DEBUG] [grpc_conn]: grpc_retry attempt: 76, backoff for 30s 
2022/08/31 19:26:13 [DEBUG] [grpc_conn]: grpc_retry attempt: 124, backoff for 30s
2022/08/31 19:26:13 [DEBUG] [grpc_conn]: grpc_retry attempt: 76, backoff for 30s 
2022/08/31 19:26:43 [DEBUG] [grpc_conn]: grpc_retry attempt: 77, backoff for 30s 
```

To reproduce:

Initiate a swap. I do not believe it matters if it's a swap out or swap in. Once the swap is in the state: `"state": "State_SwapOutSender_AwaitTxConfirmation",`, fire up `tcpkill` with the arguments mentioned above. Then wait. Eventually the swap will complete.

**Comment by nepet** [comment]
Hey, maybe I am missing the point but what I read from the logs is: you kill the connection (constantly), grpc tries to fix the connection and in the end the necessary Information (preimage) is successfully received?

**Comment by grubles** [comment]
Yes sounds right. Is this intended behavior? I don't know if this should be an instance where the swap is canceled altogether maybe?

**Comment by nepet** [comment]
As far as I can tell from your logs this is indeed intended. I will close this for now. If there are any more questions or observed misbehavior, please file a ticket again!
